{
  "schemaVersion": 1,
  "package": {
    "name": "@solidjs/web",
    "version": "2.0.0-beta.19"
  },
  "compilerFactsProtocol": 1,
  "exports": {
    "isServer": { "kind": "value" },
    "assign": { "kind": "function" },
    "getRequestEvent": { "kind": "function" },
    "render": { "kind": "function" },
    "Repeat": { "kind": "function" }
  },
  "evidence": {
    "kind": "reviewed",
    "generator": "solid-check bundled Solid 2 DOM model"
  }
}
